{
  "$schema": "http://json-schema.org/draft-07/schema#",
  "title": "cosmos-chain schema",
  "$ref": "#/definitions/chain",
  "definitions": {
    "bech32Config": {
      "type": "object",
      "properties": {
        "bech32PrefixAccAddr": { "type": "string" },
        "bech32PrefixAccPub": { "type": "string" },
        "bech32PrefixValAddr": { "type": "string" },
        "bech32PrefixValPub": { "type": "string" },
        "bech32PrefixConsAddr": { "type": "string" },
        "bech32PrefixConsPub": { "type": "string" }
      },
      "required": [
        "bech32PrefixAccAddr",
        "bech32PrefixAccPub",
        "bech32PrefixValAddr",
        "bech32PrefixValPub",
        "bech32PrefixConsAddr",
        "bech32PrefixConsPub"
      ],
      "additionalProperties": false,
      "description": "the bech32 prefixes for the chain"
    },
    "chain": {
      "type": "object",
      "properties": {
        "$schema": {
          "type": "string",
          "pattern": "^(?:\\.\\.\\/)+schemas\\/cosmos-chain\\.schema\\.json$",
          "description": "the schema file for the chain"
        },
        "rpc": {
          "type": "string",
          "format": "uri",
          "description": "Address of RPC endpoint of the chain. Default port is 26657"
        },
        "rest": {
          "type": "string",
          "format": "uri",
          "description": "Address of REST/API endpoint of the chain. Default port is 1317."
        },
        "chainId": {
          "type": "string",
          "description": "The unique identifier for the chain"
        },
        "chainName": {
          "type": "string",
          "description": "The name of the chain"
        },
        "chainIconUrl": {
          "type": "string",
          "pattern": "\\/images\\/chains\\/([a-z]+)\\.svg$",
          "description": "The icon of the chain"
        },
        "stakeCurrency": {
          "type": "object",
          "properties": {
            "coinDenom": { "type": "string" },
            "coinMinimalDenom": { "type": "string" },
            "coinDecimals": { "type": "number" },
            "coinGeckoId": { "type": "string" },
            "coinImageUrl": {
              "type": "string",
              "pattern": "\\/images\\/tokens\\/([a-z]+)\\.svg$",
              "description": "the icon for the currency, must be a relative path to a svg icon under /images/tokens"
            }
          },
          "required": ["coinDenom", "coinMinimalDenom", "coinDecimals"],
          "additionalProperties": false,
          "description": "Information on the staking token of the chain"
        },
        "walletUrlForStaking": {
          "type": "string",
          "format": "uri",
          "description": "The URL for the staking interface frontend for the chain"
        },
        "bip44": {
          "type": "object",
          "properties": { "coinType": { "type": "number" } },
          "required": ["coinType"],
          "additionalProperties": false,
          "description": "BIP44 coin type for address derivation"
        },
        "bech32Config": {
          "type": "object",
          "properties": {
            "bech32PrefixAccAddr": {
              "$ref": "#/definitions/bech32Config/properties/bech32PrefixAccAddr"
            },
            "bech32PrefixAccPub": {
              "$ref": "#/definitions/bech32Config/properties/bech32PrefixAccPub"
            },
            "bech32PrefixValAddr": {
              "$ref": "#/definitions/bech32Config/properties/bech32PrefixValAddr"
            },
            "bech32PrefixValPub": {
              "$ref": "#/definitions/bech32Config/properties/bech32PrefixValPub"
            },
            "bech32PrefixConsAddr": {
              "$ref": "#/definitions/bech32Config/properties/bech32PrefixConsAddr"
            },
            "bech32PrefixConsPub": {
              "$ref": "#/definitions/bech32Config/properties/bech32PrefixConsPub"
            }
          },
          "required": [
            "bech32PrefixAccAddr",
            "bech32PrefixAccPub",
            "bech32PrefixValAddr",
            "bech32PrefixValPub",
            "bech32PrefixConsAddr",
            "bech32PrefixConsPub"
          ],
          "additionalProperties": false,
          "description": "Bech32 config using the address prefix of the chain"
        },
        "currencies": {
          "type": "array",
          "items": { "$ref": "#/definitions/currency" },
          "description": "List of currencies on the chain"
        },
        "feeCurrencies": {
          "type": "array",
          "items": {
            "allOf": [
              { "$ref": "#/definitions/currency" },
              {
                "type": "object",
                "properties": {
                  "gasPriceStep": {
                    "type": "object",
                    "properties": {
                      "low": { "type": "number" },
                      "average": { "type": "number" },
                      "high": { "type": "number" }
                    },
                    "required": ["low", "average", "high"],
                    "additionalProperties": false
                  }
                }
              }
            ],
            "description": "a token on the chain"
          },
          "description": "List of fee tokens accepted by the chain's validator"
        },
        "features": {
          "type": "array",
          "items": {
            "type": "string",
            "enum": [
              "stargate",
              "ibc-transfer",
              "fee_grant",
              "authz",
              "cosmwasm"
            ]
          },
          "description": "List of features supported by the chain"
        }
      },
      "required": [
        "$schema",
        "rpc",
        "rest",
        "chainId",
        "chainName",
        "stakeCurrency",
        "bip44",
        "bech32Config",
        "currencies",
        "feeCurrencies"
      ],
      "additionalProperties": false,
      "description": "A Cosmos compatible chain configuration"
    },
    "currency": {
      "type": "object",
      "properties": {
        "coinDenom": {
          "$ref": "#/definitions/chain/properties/stakeCurrency/properties/coinDenom"
        },
        "coinMinimalDenom": {
          "$ref": "#/definitions/chain/properties/stakeCurrency/properties/coinMinimalDenom"
        },
        "coinDecimals": {
          "$ref": "#/definitions/chain/properties/stakeCurrency/properties/coinDecimals"
        },
        "coinGeckoId": {
          "$ref": "#/definitions/chain/properties/stakeCurrency/properties/coinGeckoId"
        },
        "coinImageUrl": {
          "$ref": "#/definitions/chain/properties/stakeCurrency/properties/coinImageUrl"
        }
      },
      "required": ["coinDenom", "coinMinimalDenom", "coinDecimals"],
      "additionalProperties": false,
      "description": "a token on the chain"
    }
  }
}
