{
  "$schema": "../../schemas/cosmos-chain.schema.json",
  "rest": "http://testnet.securesecrets.org:1317",
  "rpc": "https://testnet.rpc.axelar.dev/chain/secret",
  "chainId": "secret-snip-2",
  "chainName": "Secret Testnet",
  "stakeCurrency": {
    "coinDenom": "SCRT",
    "coinMinimalDenom": "uscrt",
    "coinDecimals": 6,
    "coinImageUrl": "/images/tokens/scrt.svg"
  },
  "bech32Config": {
    "bech32PrefixAccAddr": "secret",
    "bech32PrefixAccPub": "secretpub",
    "bech32PrefixConsAddr": "secretvalcons",
    "bech32PrefixConsPub": "secretvalconspub",
    "bech32PrefixValAddr": "secretvaloper",
    "bech32PrefixValPub": "secretvaloperpub"
  },
  "bip44": {
    "coinType": 118
  },
  "feeCurrencies": [
    {
      "coinDenom": "SCRT",
      "coinMinimalDenom": "uscrt",
      "coinDecimals": 6,
      "coinImageUrl": "/images/tokens/scrt.svg"
    }
  ],
  "currencies": [
    {
      "coinDenom": "SCRT",
      "coinMinimalDenom": "uscrt",
      "coinDecimals": 6,
      "coinImageUrl": "/images/tokens/scrt.svg"
    }
  ],
  "chainIconUrl": "/images/chains/secret.svg"
}
