{
  "$schema": "../../schemas/cosmos-chain.schema.json",
  "rest": "https://axelar-testnet-lcd.axelar-dev.workers.dev",
  "rpc": "https://testnet.rpc.axelar.dev/chain/axelar",
  "chainId": "axelar-testnet-lisbon-3",
  "chainName": "Axelar Testnet",
  "stakeCurrency": {
    "coinDenom": "AXL",
    "coinMinimalDenom": "uaxl",
    "coinDecimals": 6,
    "coinImageUrl": "/images/tokens/axl.svg"
  },
  "bech32Config": {
    "bech32PrefixAccAddr": "axelar",
    "bech32PrefixAccPub": "axelarpub",
    "bech32PrefixConsAddr": "axelarvalcons",
    "bech32PrefixConsPub": "axelarvalconspub",
    "bech32PrefixValAddr": "axelarvaloper",
    "bech32PrefixValPub": "axelarvaloperpub"
  },
  "bip44": {
    "coinType": 118
  },
  "feeCurrencies": [
    {
      "coinDenom": "AXL",
      "coinMinimalDenom": "uaxl",
      "coinDecimals": 6,
      "coinImageUrl": "/images/tokens/axl.svg"
    }
  ],
  "currencies": [
    {
      "coinDenom": "AXL",
      "coinMinimalDenom": "uaxl",
      "coinDecimals": 6,
      "coinImageUrl": "/images/tokens/axl.svg"
    }
  ],
  "chainIconUrl": "/images/chains/axelar.svg"
}
